no,sub,story,cond,res,res_corrected,scenes_xx,scenes_xz,scenes_final,group,segment_num,condition,no_char,flag
422,0526-3,3,7_r0,"Bill has problems with Doodles back at home, which is why he is running late to his class. ","Bill has problems with Doodles back at home, which is why he is running late to his class. ",1 631,0,1 631,retrodiction,7,r0,,
423,0526-3,3,7_r,Jiyoon tells Joan to book a meeting with the Title IX office about her office moving. ,Jiyoon tells Joan to book a meeting with the Title IX office about her office moving. ,702,702,702,retrodiction,7,r,,
424,0527-2,3,7_r0,Lila is hired to be Bill's TA,Lila is hired to be Bill's TA,84,84,84,retrodiction,7,r0,,
425,0527-2,3,7_r,Joan talks to Jiyoon about the problems in comparison to the male professors. ,Joan talks to Jiyoon about the problems in comparison to the male professors. ,1,0,1,retrodiction,7,r,,
426,0528-2,3,7_r0,Jiyoon wakes Bill up. Bill hurries from Jiyoon's office to his English class. ,Jiyoon wakes Bill up. Bill hurries from Jiyoon's office to his English class. ,1 1,1 0,1 1,retrodiction,7,r0,,
427,0528-2,3,7_r,Jiyoon and Joan discuss Joan's Title IX case. ,Jiyoon and Joan discuss Joan's Title IX case. ,1,731,1,retrodiction,7,r,,
428,0528-3,3,7_r0,Jiyoon is meeting with the administrative Board to vouch for Bill and that he is ready to begin teaching again. Bill oversleeps.,Jiyoon is meeting with the administrative Board to vouch for Bill and that he is ready to begin teaching again. Bill oversleeps.,1 1,0 602,0 602,retrodiction,7,r0,,
429,0528-3,3,7_r,"Joan complains to Jiyoon that she is facing discrimination as a female professor, which is hindered even more by the reputation of the English department. She complains that her office is moved unfairly. Jiyoon is stressed and overwhelmed.","Joan complains to Jiyoon that she is facing discrimination as a female professor, which is hindered even more by the reputation of the English department. She complains that her office is moved unfairly. Jiyoon is stressed and overwhelmed.",1 731 1,731,1 731 1,retrodiction,7,r,,
430,0612-1,3,7_r0,Bill has a meeting with his lawyers regarding his messy divorce. Doodles cries about the outcome. ,Bill has a meeting with his lawyers regarding his messy divorce. Doodles cries about the outcome. ,1 1,0,1 1,retrodiction,7,r0,,
431,0612-1,3,7_r,Jiyoon and Joan argue. Jiyoon tries to lightly suggest retirement. Joan is angry and fights for a better office. ,Jiyoon and Joan argue. Jiyoon tries to lightly suggest retirement. Joan is angry and fights for a better office. ,1 1 731,0,1 1 731,retrodiction,7,r,,
432,0613-1,3,7_r0,Bill gets up late and sees that he is super late for class. He hurriedly gets out of bed.,Bill gets up late and sees that he is super late for class. He hurriedly gets out of bed.,602,602,602,retrodiction,7,r0,,
433,0613-1,3,7_r,Jiyoon meets with Joan to tell her to file a title 9. ,Jiyoon meets with Joan to tell her to file a title 9. ,702,702,702,retrodiction,7,r,,
434,0615-1,3,7_r0,"Doodles, Lila, and Dafna talk about how Dafna gave Bill a ride home the other day. Lila is frustrated that Bill isn't reading the draft of her dissertation and complains that Bill is always late to class. ","Doodles, Lila, and Dafna talk about how Dafna gave Bill a ride home the other day. Lila is frustrated that Bill isn't reading the draft of her dissertation and complains that Bill is always late to class. ",1 632 1 1,0,1 1 1 1,retrodiction,7,r0,,
435,0615-1,3,7_r,"Jiyoon and Joan talk about Joan's office move to the athletics building. Joan is angry and frustrated. ""I've been teaching in this department for 32 YEARS! How can you let this happen?"" Jiyoon informs her that this was a department wide decision.","Jiyoon and Joan talk about Joan's office move to the athletics building. Joan is angry and frustrated. ""I've been teaching in this department for 32 YEARS! How can you let this happen?"" Jiyoon informs her that this was a department wide decision.",731 1 1,731,731 1 1,retrodiction,7,r,,
436,0616-1,3,7_r0,Bill is late for class! Lila is very stressed because he has not read her dissertation and she wants to defend soon. Bill is late because he is in Jiyoon's office! ,Bill is late for class! Lila is very stressed because he has not read her dissertation and she wants to defend soon. Bill is late because he is in Jiyoon's office! ,631 1 1,0 1 1,631 1 1,retrodiction,7,r0,,
437,0616-1,3,7_r,Jiyoon and Joan are having a meeting because Joan is complaining that her office got moved. Jiyoon thinks they should go to the title 9 office.,Jiyoon and Joan are having a meeting because Joan is complaining that her office got moved. Jiyoon thinks they should go to the title 9 office.,731 702,731 702,731 702,retrodiction,7,r,,
438,0619-1,3,7_r0,Joan receives the news that her office is moved and calls Paul to complain. Dafna gives Bill a lift to class.,Joan receives the news that her office is moved and calls the Dean to complain. Dafna gives Bill a lift to class.,151 1 606,606,151 1 606,retrodiction,7,r0,,
439,0619-1,3,7_r,Joan confronts Jiyoon about her office placement and thinks it's discrimination. Jiyoon suggests they go to Title IX to sort the issue out.,Joan confronts Jiyoon about her office placement and thinks it's discrimination. Jiyoon suggests they go to Title IX to sort the issue out.,731 702,731 702,731 702,retrodiction,7,r,,
440,0706-1,3,7_r0,Lila is increasingly concerned about Bill's irresponsible behavior at work. The Dean reaches out to Jiyoon to manage Bill. ,Lila is increasingly concerned about Bill's irresponsible behavior at work. The Dean reaches out to Jiyoon to manage Bill. ,1 1,0,1 1,retrodiction,7,r0,,
441,0706-1,3,7_r,"Lila is increasingly concerned about Bill's irresponsible behavior at work. Joan reaches out to Jiyoon to manage Bill.
","Lila is increasingly concerned about Bill's irresponsible behavior at work. Joan reaches out to Jiyoon to manage Bill.
",1 1,0,1 1,retrodiction,7,r,,
442,0707-1,3,7_r0,Joan is assigned a new office during a meeting with Paul and Elliot. ,Joan is assigned a new office during a meeting with the Dean and Elliot. ,79 1,0,79 1,retrodiction,7,r0,,
443,0707-1,3,7_r,Joan complains to Jiyoon about her new office assignment. They visit the office together and they both share disgust and anger about the situation. They decide to file a complaint with Title IX. ,Joan complains to Jiyoon about her new office assignment. They visit the office together and they both share disgust and anger about the situation. They decide to file a complaint with Title IX. ,731 701 732,701 731 732,731 701 732,retrodiction,7,r,,
444,0707-2,3,7_r0,Bill drops his daughter Doodles off at school.,Bill drops his daughter Doodles off at school.,1,0,1,retrodiction,7,r0,,
445,0707-2,3,7_r,Joan comes to Jiyoon to complain about the change in her office location. ,Joan comes to Jiyoon to complain about the change in her office location. ,731,731,731,retrodiction,7,r,,
446,0522-2,3,7_p0,,,1 1,0,1 1,prediction,7,p0,,
447,0522-2,3,7_p,,,1 1,609,1 1,prediction,7,p,,
448,0523-1,3,7_p0,Joan and Jiyoon talk about the department and how each other's classes are going Jiyoon attempts to give Joan advice about how to change it up to make it more interesting for her students. ,Joan and Jiyoon talk about the department and how each other's classes are going Jiyoon attempts to give Joan advice about how to change it up to make it more interesting for her students. ,1 1,704,1 1,prediction,7,p0,,
449,0523-1,3,7_p,"Joan and Jiyoon talk about the department and how each other's classes are going Jiyoon attempts to give Joan advice about how to change it up to make it more interesting for her students.
","Joan and Jiyoon talk about the department and how each other's classes are going Jiyoon attempts to give Joan advice about how to change it up to make it more interesting for her students.
",1 1,704,1 1,prediction,7,p,,
450,0523-3,3,7_p0,"Bill arrives at his class and it is packed with students. Bill lets Dafna off the waitlist for his class. Joan complains to Jiyoon about how no body appreciates classic literature anymore,","Bill arrives at his class and it is packed with students. Bill lets Dafna off the waitlist for his class. Joan complains to Jiyoon about how no body appreciates classic literature anymore,",801 1 1,801,801 1 1,prediction,7,p0,,
451,0523-3,3,7_p,"Bill arrives at his class and it is packed with students. Bill lets Dafna off the waitlist for his class. Joan complains to Jiyoon about how no body appreciates classic literature anymore.
","Bill arrives at his class and it is packed with students. Bill lets Dafna off the waitlist for his class. Joan complains to Jiyoon about how no body appreciates classic literature anymore.
",801 1 1,801,801 1 1,prediction,7,p,,
452,0523-5,3,7_p0,"Bill arrives to class, late, to the dismay of Lila.","Bill arrives to class, late, to the dismay of Lila.",801 0,1 1,801 0,prediction,7,p0,,
453,0523-5,3,7_p,"Jiyoon and Joan have coffee and walk outside, talking about some of the struggles faced by the department.","Jiyoon and Joan have coffee and walk outside, talking about some of the struggles faced by the department.",1 1,0,1 1,prediction,7,p,,
454,0524-2,3,7_p0,"Joan complains to Jiyoon about her awful day of teaching, and Yaz bursts in to complain about Elliot. Her predictions were correct: Elliot treats her like a TA, and the students do not enjoy his teaching.","Joan complains to Jiyoon about her awful day of teaching, and Yaz bursts in to complain about Elliot. Her predictions were correct: Elliot treats her like a TA, and the students do not enjoy his teaching.",1 1 0,1,1 1 0,prediction,7,p0,,
455,0524-2,3,7_p,Jiyoon and Joan have coffee while Joan complains about her awful first day. They discuss how kids these days are much more difficult to teach.,Jiyoon and Joan have coffee while Joan complains about her awful first day. They discuss how kids these days are much more difficult to teach.,1 1 1,0,1 1 1,prediction,7,p,,
456,0525-2,3,7_p0,Bill wrote a heartfelt message to Dafna in her book. Yaz gets fed up with Elliot and tells him off in private. Joan tells Jiyoon that she's upset by the lack of interest from her students. ,Bill wrote a heartfelt message to Dafna in her book. Yaz gets fed up with Elliot and tells him off in private. Joan tells Jiyoon that she's upset by the lack of interest from her students. ,1 1 1 1,0,1 1 1 1,prediction,7,p0,,
457,0525-2,3,7_p,Bill wrote a heartfelt message to Dafna in her book. Yaz gets fed up with Elliot and tells him off in private. Joan tells Jiyoon that she's upset by the lack of interest from her students.,Bill wrote a heartfelt message to Dafna in her book. Yaz gets fed up with Elliot and tells him off in private. Joan tells Jiyoon that she's upset by the lack of interest from her students.,1 1 1 1,0,1 1 1 1,prediction,7,p,,
458,0526-2,3,7_p0,Dafna finds out Bill wrote a funny/concerning statement int he book instead of signing it,Dafna finds out Bill wrote a funny/concerning statement int he book instead of signing it,1,0,1,prediction,7,p0,,
459,0526-2,3,7_p,Jiyoon opens the door to Joan and Joan,Jiyoon opens the door to Joan and Joan,1,0,1,prediction,7,p,,
460,0527-1,3,7_p0,"Dafna will get off the waitlist into Bill's class. The faculty are surprised to see Bill arrive, but they are not surprised by his clumsiness. Yaz and Elliot confront Jiyoon and tell her that the plan is not working.","Dafna will get off the waitlist into Bill's class. The faculty are surprised to see Bill arrive, but they are not surprised by his clumsiness. Yaz and Elliot confront Jiyoon and tell her that the plan is not working.",1 1 1,0,1 1 1,prediction,7,p0,,
461,0527-1,3,7_p,Jiyoon and Joan have a meeting about the other faculty and about Joan's classes.,Jiyoon and Joan have a meeting about the other faculty and about Joan's classes.,1 1,703,1 1,prediction,7,p,,
462,0528-1,3,7_p0,Lila yells at Bill for coming in late and they have a conversation about Bill being a mess and sad. Jiyoon and Joan chat over coffee. Jiyoon and Yaz talk about Elliot being a horrible co-teacher. ,Lila yells at Bill for coming in late and they have a conversation about Bill being a mess and sad. Jiyoon and Joan chat over coffee. Jiyoon and Yaz talk about Elliot being a horrible co-teacher. ,1 1 1 1,1,1 1 1 1,prediction,7,p0,,
463,0528-1,3,7_p,Jiyoon and Joan have a conversation together over coffee. ,Jiyoon and Joan have a conversation together over coffee. ,1,1,1,prediction,7,p,,
464,0608-1,3,7_p0,Joan and Jiyoon have coffee and discuss how their classes are going. Jiyoon tries to give Joan some advice but Joan is reluctant to budge with her method.,Joan and Jiyoon have coffee and discuss how their classes are going. Jiyoon tries to give Joan some advice but Joan is reluctant to budge with her method.,1 1 1 1,0,1 1 1 1,prediction,7,p0,,
465,0608-1,3,7_p,"Keeping it the same, Joan and Jiyoon have coffee and discuss how their classes are going. Jiyoon tries to give Joan some advice but Joan is reluctant to budge with her method.
","Joan and Jiyoon have coffee and discuss how their classes are going. Jiyoon tries to give Joan some advice but Joan is reluctant to budge with her method.
",1 1 1 1,0,1 1 1 1,prediction,7,p,,
466,0608-2,3,7_p0,Bill walks into the class but it's already being taught by Lila. Lila and Bill have a dispute. Jiyoon and Joan talk together. Joan asks why her students are not as engaging.,Bill walks into the class but it's already being taught by Lila. Lila and Bill have a dispute. Jiyoon and Joan talk together. Joan asks why her students are not as engaging.,801 1 1 1 1,0,801 1 1 1 1,prediction,7,p0,,
467,0608-2,3,7_p,Joan asks Jiyoon why her students are not as engaging as other classes or in the past. Jiyoon tells her about the new generation and new age. Joan disagrees and gets mad.,Joan asks Jiyoon why her students are not as engaging as other classes or in the past. Jiyoon tells her about the new generation and new age. Joan disagrees and gets mad.,1 1 1 1,0,1 1 1 1,prediction,7,p,,
468,0611-1,3,7_p0,"Bill reaches his class extremely late, while everyone is leaving (the class ended 5-10 min ago, perhaps?). Jaon and Jiyoon have a coffee meeting where they discuss improvement in the classroom. Yaz hates being talked down to and students start dropping out of the course.","Bill reaches his class extremely late, while everyone is leaving (the class ended 5-10 min ago, perhaps?). Joan and Jiyoon have a coffee meeting where they discuss improvement in the classroom. Yaz hates being talked down to and students start dropping out of the course.",801 1 1 1 1,0,801 1 1 1 1,prediction,7,p0,,
469,0611-1,3,7_p,Jaon and Jiyoon have a coffee meeting where they discuss improvement in the classroom. Jiyoon tells her about her meeting with the Dean. Joan goes on a killing spree.,Joan and Jiyoon have a coffee meeting where they discuss improvement in the classroom. Jiyoon tells her about her meeting with the Dean. Joan goes on a killing spree.,1 1 733 1,0,1 1 733 1,prediction,7,p,,
470,0612-2,3,7_p0,Yaz complains to Jiyoon about how terrible lecturing with Elliot has been going. Bill finally shows up to teach his class. ,Yaz complains to Jiyoon about how terrible lecturing with Elliot has been going. Bill finally shows up to teach his class. ,1 801,0 801,1 801,prediction,7,p0,,
471,0612-2,3,7_p,Joan asks Jiyoon for advice on how to get her students more engaged. Jiyoon tries to talk to Jiyoon about retirement.,Joan asks Jiyoon for advice on how to get her students more engaged. Jiyoon tries to talk to Jiyoon about retirement.,1 1,0,1 1,prediction,7,p,,
472,0614-1,3,7_p0,Bill will walk into his lecture hall and it will be completely empty. Lila will be there pacing angrily. Bill and Lila will get into a confrontation. ,Bill will walk into his lecture hall and it will be completely empty. Lila will be there pacing angrily. Bill and Lila will get into a confrontation. ,801 1 1 1,0,801 1 1 1,prediction,7,p0,,
473,0614-1,3,7_p,"Jiyoon and Joan will have coffee in the staff lounge. While they are having coffee Joan will complain about how students are not interested in English classes. Jiyoon will tell Joan it is not the material that is hard for them, but how you asks them to interact. Jiyoon will give Joan tips on how to get the younger generation more excited about her class. ","Jiyoon and Joan will have coffee in the staff lounge. While they are having coffee Joan will complain about how students are not interested in English classes. Jiyoon will tell Joan it is not the material that is hard for them, but how you asks them to interact. Jiyoon will give Joan tips on how to get the younger generation more excited about her class. ",1 1 1 1,0,1 1 1 1,prediction,7,p,,
474,0615-2,3,7_p0,"As Bill is late to his class, Lila, his TA, tries to cover up for a lecture. Elliot keeps his condescending attitude toward Yaz and bossses around, reminding her of the tenure review which is close. ","As Bill is late to his class, Lila, his TA, tries to cover up for a lecture. Elliot keeps his condescending attitude toward Yaz and bossses around, reminding her of the tenure review which is close. ",1 1 1,0,1 1 1,prediction,7,p0,,
475,0615-2,3,7_p,"Jiyoon joins Joan for a coffee after her class. Joan pleads Jiyoon to do something about her moved office, to bring her back to the department building.","Jiyoon joins Joan for a coffee after her class. Joan pleads Jiyoon to do something about her moved office, to bring her back to the department building.",1 731,731,1 731,prediction,7,p,,
476,0615-3,3,7_p0,,,1 1 1 731,731,1 1 1 731,prediction,7,p0,,
477,0615-3,3,7_p,,,1 1 1 731,731,1 1 1 731,prediction,7,p,,
478,0619-2,3,7_p0,"Elliot is teaching class, while Yaz is being ushered by him. The students have a calm discussion about the class' topics.","Elliot is teaching class, while Yaz is being ushered by him. The students have a calm discussion about the class' topics.",1 1 1,1 1 1,1 1 1,prediction,7,p0,,
479,0619-2,3,7_p,"Jiyoon is frustrated with the outcome of her conversation with Elliot. So, she gets to Joan. Joan does not seem to pay much attention to Jiyoon, but Jiyoon insists on getting her word out there.","Jiyoon is frustrated with the outcome of her conversation with Elliot. So, she gets to Joan. Joan does not seem to pay much attention to Jiyoon, but Jiyoon insists on getting her word out there.",1 1 1 1,0,1 1 1 1,prediction,7,p,,
480,0629-1,3,7_p0,Bill begins to lecture his class. Jiyoon and Joan have a conversation about teaching.,Bill begins to lecture his class. Jiyoon and Joan have a conversation about teaching.,801 1,0,801 1,prediction,7,p0,,
481,0629-1,3,7_p,Jiyoon and Joan have a conversation about teaching.,Jiyoon and Joan have a conversation about teaching.,1,0,1,prediction,7,p,,
482,0522-1,3,8_r0,"Yaz is a younger prof in the english department who was recently given a new role. She finds ways to connect more with the new age of students, giving the assignments like ""tweeting"" the flashiest line from their readings. Elliot does not share the same outlook on his teaching","Yaz is a younger prof in the english department who was recently given a new role. She finds ways to connect more with the new age of students, giving the assignments like ""tweeting"" the flashiest line from their readings. Elliot does not share the same outlook on his teaching",0 0 64 1 ,64,0 0 64 1 ,retrodiction,8,r0,,
483,0522-1,3,8_r,"Lila is Bill's TA, trying to help him organize his curriculum to reach his students. ","Lila is Bill's TA, trying to help him organize his curriculum to reach his students. ",0,84,0,retrodiction,8,r,,
484,0522-3,3,8_r0,,,1,0,1,retrodiction,8,r0,,
485,0522-3,3,8_r,,,1 1 81 1,0 81,1 1 81 1,retrodiction,8,r,,
486,0523-2,3,8_r0,"Bill, Doodles.

Bill speaks to his daughter about the car getting impounded. Says he has a ride figured out.",Bill speaks to his daughter about the car getting impounded. Says he has a ride figured out.,1 1,0 81,1 1,retrodiction,8,r0,,
487,0523-2,3,8_r,Bill tells Lila what they are doing for class this week.,Bill tells Lila what they are doing for class this week.,1,0,1,retrodiction,8,r,,
488,0523-4,3,8_r0,"The Dean meets with Jiyoon about who should become the Melfield scholar, and Jiyoon suggests Yaz instead of Elliot. Elliot is sent to Yaz's office to do an evaluation on her current teaching methods.","The Dean meets with Jiyoon about who should become the Melfield scholar, and Jiyoon suggests Yaz instead of Elliot. Elliot is sent to Yaz's office to do an evaluation on her current teaching methods.",331 303 1,0,331 303 1,retrodiction,8,r0,,
489,0523-4,3,8_r,"Bill shows up at the end of class. which Lila has just taught since he wasn't there. Bill promises her that it won't happen again, and Lila isn't sure what to do.","Bill shows up at the end of class. which Lila has just taught since he wasn't there. Bill promises her that it won't happen again, and Lila isn't sure what to do.",801 1 1 1,0,801 1 1 1,retrodiction,8,r,,
490,0524-1,3,8_r0,Elliot looks over Yaz's syllabus and points out that she should restructure her class and the way she teaches certain important topics.,Elliot looks over Yaz's syllabus and points out that she should restructure her class and the way she teaches certain important topics.,1 1,0,1 1,retrodiction,8,r0,,
491,0524-1,3,8_r,Lila is frustrated at Bill for not being a good teacher.,Lila is frustrated at Bill for not being a good teacher.,1,0,1,retrodiction,8,r,,
492,0525-1,3,8_r0,"Characters: Yaz
Yaz is on the phone with friends/family after a long day of work and is discussing the frustrations she feels with her position and how her colleagues make her feel inferior.",Yaz is on the phone with friends/family after a long day of work and is discussing the frustrations she feels with her position and how her colleagues make her feel inferior.,1 1,0,1 1,retrodiction,8,r0,,
493,0525-1,3,8_r,"Lila nervously approaches Bill to let him know of the concerns she has received from students about his teaching. Bill basically ignores her complaints, and she has no choice but to take matters to a higher authority.","Lila nervously approaches Bill to let him know of the concerns she has received from students about his teaching. Bill basically ignores her complaints, and she has no choice but to take matters to a higher authority.",1 1 1,0,1 1 1,retrodiction,8,r,,
494,0526-1,3,8_r0,Yaz teaches a class and is trying to connect with her students,Yaz teaches a class and is trying to connect with her students,402,402,402,retrodiction,8,r0,,
495,0526-1,3,8_r,Lila gets upset with Bill for being late to class and leaving too much work for her,Lila gets upset with Bill for being late to class and leaving too much work for her,1 1,601 631,1 631,retrodiction,8,r,,
496,0526-3,3,8_r0,Dean wants Elliot to revise his methods by working with Yaz.,The Dean wants Elliot to revise his methods by working with Yaz.,1,501,1,retrodiction,8,r0,,
497,0526-3,3,8_r,Lila has problems with Bill's inability to show up to class and his syllabus. ,Lila has problems with Bill's inability to show up to class and his syllabus. ,1,631,631,retrodiction,8,r,,
498,0527-2,3,8_r0,Elliot and Joan discuss talking about Yaz's new influence.,Elliot and Joan discuss talking about Yaz's new influence.,1,0,1,retrodiction,8,r0,,
499,0527-2,3,8_r,Lila tries to help Bill with his work.,Lila tries to help Bill with his work.,1,553,1,retrodiction,8,r,,
500,0528-2,3,8_r0,The Dean discusses the English department with Jiyoon. ,The Dean discusses the English department with Jiyoon. ,305,331 305,305,retrodiction,8,r0,,
501,0528-2,3,8_r,Bill and Lila discuss their English class. ,Bill and Lila discuss their English class. ,1,0,1,retrodiction,8,r,,
502,0528-3,3,8_r0,"Elliot, a distinguished English scholar is brought in to determine whether Yaz should be given tenure. He also meets with Joan. The Dean expresses to Jiyoon that the English department is insufficient and unnecessary.","Elliot, a distinguished English scholar is brought in to determine whether Yaz should be given tenure. He also meets with Joan. The Dean expresses to Jiyoon that the English department is insufficient and unnecessary.",352 1 305,352,352 1 305,retrodiction,8,r0,,
503,0528-3,3,8_r,Bill and Lila meet to discuss the structure of the upcoming school year. Bill has nothing planned and Lila is concerned and frustrated.,Bill and Lila meet to discuss the structure of the upcoming school year. Bill has nothing planned and Lila is concerned and frustrated.,1 1 1,0 1,1 1 1,retrodiction,8,r,,
504,0612-1,3,8_r0,There is an English department meeting where there are professors from different generations that have different ways of teaching. Jiyoon defends bill.  ,There is an English department meeting where there are professors from different generations that have different ways of teaching. Jiyoon defends bill.  ,132 107,132 133,132 107,retrodiction,8,r0,,
505,0612-1,3,8_r,Bill tries to develop his class a bit more but not that hard. Lila is annoyed at his lack of ambition.,Bill tries to develop his class a bit more but not that hard. Lila is annoyed at his lack of ambition.,1 1,0,1 1,retrodiction,8,r,,
506,0613-1,3,8_r0,We see a scene of Jiyoon looking over how the teachers are teaching their classes.,We see a scene of Jiyoon looking over how the teachers are teaching their classes.,1,0,1,retrodiction,8,r0,,
507,0613-1,3,8_r,"Bill, as a fun teacher, is making jokes to Lila and basically going over what needs to be done. ","Bill, as a fun teacher, is making jokes to Lila and basically going over what needs to be done. ",1 1,0,1 1,retrodiction,8,r,,
